Title,Media URL,Pinterest board,Thumbnail,Description,Link,Publish date,Keywords
The Skincare Myth of 'Squeaky Clean' — Why Gentle Cleansing Actually Matters,https://cdn.shopify.com/s/files/1/0803/5283/7944/articles/the-skincare-myth-of-squeaky-clean-why-gentle-cleansing-actually-matters-9167735.png?v=1775522401,HARAMOON K-Beauty Skincare,,"There's a persistent belief in skincare that if your face doesn't feel tight and squeaky after washing, it isn't truly clean. It's one of the most widespread myths in beauty — and one of the most damaging. That squeaky sensation isn't purity. It's your skin barrier telling you something has gone wrong. | Shop at waxandwane.store",https://www.waxandwane.store/blogs/haramoon/the-skincare-myth-of-squeaky-clean-_-why-gentle-cleansing-matters,,"Korean Cleanser, Korean Sunscreen, Skin Barrier, Vegan Skincare, Glass Skin, K-Beauty, Korean Skincare, HARAMOON, Wax and Wane"
Sea Buckthorn Oil: The Antioxidant Glow Giver,https://cdn.shopify.com/s/files/1/0803/5283/7944/articles/sea-buckthorn-oil-the-antioxidant-glow-giver-8001336.png?v=1775522399,HARAMOON K-Beauty Skincare,,"Sea Buckthorn Oil: The Antioxidant Glow GiverIf you're looking for a single ingredient that delivers antioxidant protection, skin regeneration, barrier support, and a radiant glow, sea buckthorn oil might be your answer. This golden-orange oil is one of nature's most nutrient-dense skincare ingredients, packed with over 190 bioactive compounds that work synergistically to tr... | Shop at waxandwane.store",https://www.waxandwane.store/blogs/haramoon/sea-buckthorn-oil_-the-antioxidant-glow-giver,,"Hyaluronic Acid, Niacinamide, Peptides, Vitamin C, SPF Sunscreen, Korean Toner, Korean Moisturizer, Korean Serum, Korean Cleanser, Korean Sunscreen, Skin Barrier, Collagen"
Syn-Hycan: Your Skin's Elasticity Architect,https://cdn.shopify.com/s/files/1/0803/5283/7944/articles/syn-hycan-your-skins-elasticity-architect-5848405.png?v=1775522396,HARAMOON K-Beauty Skincare,,"What Is Syn-Hycan?Syn-Hycan (also known as Sodium Hyaluronate Crosspolymer) is a next-generation hyaluronic acid derivative engineered to deliver superior elasticity, hydration, and structural support to aging or stressed skin. Unlike traditional hyaluronic acid, which primarily focuses on surface hydration, Syn-Hycan creates a three-dimensional network within the skin that ... | Shop at waxandwane.store",https://www.waxandwane.store/blogs/haramoon/syn-hycan_-your-skin-aos-elasticity-architect,,"Hyaluronic Acid, Ceramides, Niacinamide, Peptides, Retinol, Vitamin C, Korean Toner, Korean Moisturizer, Korean Serum, Korean Sunscreen, Skin Barrier, Collagen"
Ingredient Spotlight: Why Coconut-Derived Cleansing Agents Are Changing the Game,https://cdn.shopify.com/s/files/1/0803/5283/7944/articles/ingredient-spotlight-why-coconut-derived-cleansing-agents-are-changing-the-game-2289788.png?v=1775522392,HARAMOON K-Beauty Skincare,,"In the world of clean beauty, few ingredients have made as quiet — and as significant — an impact as coconut-derived cleansing agents. Derived from one of nature’s most versatile sources, compounds like cocamidopropyl betaine and lauric acid are doing something most synthetic surfactants can’t: cleansing effectively without disrupting the skin’s natural balance. | Shop at waxandwane.store",https://www.waxandwane.store/blogs/haramoon/ingredient-spotlight_-why-coconut-derived-cleansing-agents-are-changing-the-game,,"Hyaluronic Acid, Korean Cleanser, Skin Barrier, Vegan Skincare, K-Beauty, Korean Skincare, HARAMOON, Wax and Wane"
Licorice Root (Dipotassium Glycyrrhizate) - Calming Brightness in a Bottle,https://cdn.shopify.com/s/files/1/0803/5283/7944/articles/licorice-root-dipotassium-glycyrrhizate-calming-brightness-in-a-bottle-5297441.jpg?v=1775522388,HARAMOON K-Beauty Skincare,,"Licorice Root (Dipotassium Glycyrrhizate): Calming Brightness in a BottleIn the world of brightening skincare, ingredients like vitamin C and niacinamide often steal the spotlight. But there's a gentler, equally effective player that deserves more recognition: licorice root extract, specifically its derivative dipotassium glycyrrhizate.This water-soluble compound has been a ... | Shop at waxandwane.store",https://www.waxandwane.store/blogs/haramoon/licorice-root-dipotassium-glycyrrhizate_-calming-brightness-in-a-bottle,,"Hyaluronic Acid, Niacinamide, Peptides, Vitamin C, SPF Sunscreen, Korean Toner, Korean Moisturizer, Korean Serum, Korean Cleanser, Korean Sunscreen, Skin Barrier, Centella Asiatica"
Allantoin: The Quiet Healer Your Skin Has Been Craving,https://cdn.shopify.com/s/files/1/0803/5283/7944/articles/allantoin-the-quiet-healer-your-skin-has-been-craving-5962858.png?v=1775522386,HARAMOON K-Beauty Skincare,,"In a world of loud, trend-chasing skincare ingredients, allantoin works quietly — and that’s exactly what makes it so valuable. Derived from plants like comfrey, chamomile, and sugar beet, this gentle compound has been used for centuries to calm, heal, and restore skin. Today, it’s a cornerstone of K-beauty formulation and a staple in clean, vegan skincare — and if it’s not ... | Shop at waxandwane.store",https://www.waxandwane.store/blogs/haramoon/allantoin_-the-quiet-healer-your-skin-craves,,"Hyaluronic Acid, Ceramides, Niacinamide, Korean Toner, Korean Serum, Korean Cleanser, Skin Barrier, Collagen, Centella Asiatica, Vegan Skincare, K-Beauty, Korean Skincare"
Jeju Seawater: The Mineral-Rich Reset Your Skin Needs,https://cdn.shopify.com/s/files/1/0803/5283/7944/articles/jeju-seawater-the-mineral-rich-reset-your-skin-needs-9059387.jpg?v=1775522383,HARAMOON K-Beauty Skincare,,"Jeju Seawater: The Mineral-Rich Reset Your Skin NeedsIn the world of Korean skincare, few ingredients carry the mystique and proven efficacy of Jeju Island seawater. Sourced from the pristine waters surrounding South Korea's volcanic island paradise, this marine ingredient has become a staple in K-beauty formulations—and for good reason.Jeju seawater isn't just ocean water i... | Shop at waxandwane.store",https://www.waxandwane.store/blogs/haramoon/jeju-seawater_-the-mineral-rich-reset-your-skin-needs,,"Hyaluronic Acid, Ceramides, Niacinamide, Peptides, SPF Sunscreen, Korean Toner, Korean Moisturizer, Korean Serum, Korean Cleanser, Korean Sunscreen, Skin Barrier, Collagen"
“How Korean Formulas Are Changing the Way We Treat Sun-Damaged Skin”,https://cdn.shopify.com/s/files/1/0803/5283/7944/articles/how-korean-formulas-are-changing-the-way-we-treat-sun-damaged-skin-6066977.jpg?v=1775522379,HARAMOON K-Beauty Skincare,,"How Korean Formulas Are Changing the Way We Treat Sun-Damaged SkinSun damage is one of the most common—and most preventable—skin concerns. Yet for decades, Western skincare focused primarily on SPF protection while offering limited solutions for repairing existing photoaging. Enter Korean skincare, which has revolutionized the conversation around sun damage with a holistic, ... | Shop at waxandwane.store",https://www.waxandwane.store/blogs/haramoon/how-korean-formulas-are-changing-the-way-we-treat-sun-damaged-skin,,"Hyaluronic Acid, Ceramides, Niacinamide, Peptides, Vitamin C, SPF Sunscreen, Korean Toner, Korean Moisturizer, Korean Serum, Korean Cleanser, Korean Sunscreen, Skin Barrier"
The 7-Layer Method: How to Maximize Hyaluronic Acid Absorption,https://cdn.shopify.com/s/files/1/0803/5283/7944/articles/the-7-layer-method-how-to-maximize-hyaluronic-acid-absorption-9109781.png?v=1775522377,HARAMOON K-Beauty Skincare,,"If you've ever applied a hyaluronic acid serum and still felt dry an hour later, the problem likely isn't the product — it's the application. The Korean 7-layer method is a technique built on a simple but powerful idea: thin, repeated layers of a hydrating toner or essence absorb more effectively than one heavy application, building genuine, lasting moisture rather than surf... | Shop at waxandwane.store",https://www.waxandwane.store/blogs/haramoon/the-7-layer-method_-how-to-maximize-hyaluronic-acid-absorption,,"Hyaluronic Acid, Korean Toner, Korean Moisturizer, Korean Serum, Korean Cleanser, Skin Barrier, Vegan Skincare, Glass Skin, K-Beauty, Korean Skincare, HARAMOON, Wax and Wane"
Why Your Skin Barrier Needs a Break — The Science Behind Gentle Toners,https://cdn.shopify.com/s/files/1/0803/5283/7944/articles/why-your-skin-barrier-needs-a-break-the-science-behind-gentle-toners-6233839.png?v=1775522374,HARAMOON K-Beauty Skincare,,"In the daily grind of modern life, your skin is quietly absorbing a lot — pollution, stress, and the cumulative effects of harsh skincare products. Think of your skin barrier as a fortress: protective and resilient, but vulnerable to wear over time. When it's overwhelmed, it signals for help through dryness, sensitivity, and breakouts. | Shop at waxandwane.store",https://www.waxandwane.store/blogs/haramoon/why-your-skin-barrier-needs-a-break_-the-science-behind-gentle-toners,,"Ceramides, Niacinamide, Korean Toner, Korean Cleanser, Skin Barrier, Vegan Skincare, K-Beauty, Korean Skincare, HARAMOON, Wax and Wane"
What Does a Firming Serum Actually Do? The Science Explained,https://cdn.shopify.com/s/files/1/0803/5283/7944/articles/what-does-a-firming-serum-actually-do-the-science-explained-8395370.png?v=1775522370,HARAMOON K-Beauty Skincare,,"In skincare, few promises are made more often — or understood less — than ""firming."" Whether you're drawn to K-beauty rituals, plant-based formulas, or clinically-tested actives, the science behind firming serums is worth knowing. Here's what's actually happening when you apply one. | Shop at waxandwane.store",https://www.waxandwane.store/blogs/haramoon/what-a-firming-serum-actually-does-according-to-science,,"Hyaluronic Acid, Peptides, Korean Serum, Collagen, Vegan Skincare, K-Beauty, Korean Skincare, HARAMOON, Wax and Wane"
"Unlock Your Best Skin: Soothe, Hydrate, and Strengthen with Centella Asiatica",https://cdn.shopify.com/s/files/1/0803/5283/7944/articles/unlock-your-best-skin-soothe-hydrate-and-strengthen-with-centella-asiatica-7878566.png?v=1767479355,HARAMOON K-Beauty Skincare,,"What is Centella Asiatica?Centella Asiatica, also known as Cica or Tiger Grass, is a powerhouse botanical ingredient that has been a cornerstone of Korean skincare (K-beauty) for generations. This ancient herb, revered in traditional Asian medicine for centuries, has earned its place in modern skincare through proven benefits for soothing, healing, and strengthening the skin... | Shop at waxandwane.store",https://www.waxandwane.store/blogs/haramoon/unlock-your-best-skin-soothe-hydrate-and-strengthen-with-centella-asiatica,,"Hyaluronic Acid, Ceramides, Niacinamide, Peptides, Korean Toner, Korean Moisturizer, Korean Serum, Skin Barrier, Collagen, Centella Asiatica, K-Beauty, Korean Skincare"
Unlock Your Dewiest Skin Yet: HARAMOON's Silky Hydration Ampoule Review,https://cdn.shopify.com/s/files/1/0803/5283/7944/articles/unlock-your-dewiest-skin-yet-haramoons-silky-hydration-ampoule-review-4602907.png?v=1768602419,HARAMOON K-Beauty Skincare,,"The Secret to Glass Skin: Concentrated Hydration in Every DropIf you've been chasing that elusive glass skin glow—the kind that looks lit from within, plump, dewy, and impossibly smooth—the HARAMOON Silky Hydration Ampoule is about to become your new obsession.This isn't just another serum. It's a concentrated hydration treatment that delivers visible results from the very f... | Shop at waxandwane.store",https://www.waxandwane.store/blogs/haramoon/unlock-your-dewiest-skin-yet-haramoons-silky-hydration-ampoule-review,,"Hyaluronic Acid, Niacinamide, Korean Toner, Korean Moisturizer, Korean Serum, Korean Cleanser, Korean Sunscreen, Skin Barrier, Collagen, Centella Asiatica, Glass Skin, K-Beauty"
"Unlock Your Glow: The Korean Secret to Hydrated, Balanced Skin Starts with HARAMOON's Pure Moisture ",https://cdn.shopify.com/s/files/1/0803/5283/7944/articles/unlock-your-glow-the-korean-secret-to-hydrated-balanced-skin-starts-with-haramoons-pure-moisture-cleanser-3839097.png?v=1767479354,HARAMOON K-Beauty Skincare,,"Are you tired of cleansers that leave your skin feeling tight, dry, and stripped? Do you dream of a complexion that's clear, comfortable, and radiantly healthy? The secret might just lie in a K-beauty staple: the perfect pH-balanced cleanser. And HARAMOON's Pure Moisture Cleanser is here to revolutionize your skincare routine.We all know that cleansing is the foundation of a... | Shop at waxandwane.store",https://www.waxandwane.store/blogs/haramoon/unlock-your-glow-the-korean-secret-to-hydrated-balanced-skin-starts-with-haramoons-pure-moisture-cleanser,,"Korean Toner, Korean Moisturizer, Korean Serum, Korean Cleanser, Korean Sunscreen, Skin Barrier, K-Beauty, Korean Skincare, HARAMOON, Wax and Wane"
"Dive Deep into Hydration: HARAMOON's Super Dam Toner for Calm, Radiant Skin",https://cdn.shopify.com/s/files/1/0803/5283/7944/articles/dive-deep-into-hydration-haramoons-super-dam-toner-for-calm-radiant-skin-2402390.png?v=1768602415,HARAMOON K-Beauty Skincare,,"The Foundation of Hydrated, Resilient SkinIn the world of K-beauty, toners are not an afterthought—they're the cornerstone of every effective routine. The HARAMOON Super Dam Toner takes this philosophy to the next level, delivering multi-weight hyaluronic acid hydration that penetrates every layer of your skin for lasting moisture, plumpness, and barrier support.If you've be... | Shop at waxandwane.store",https://www.waxandwane.store/blogs/haramoon/dive-deep-into-hydration-haramoons-super-dam-toner-for-calm-radiant-skin,,"Hyaluronic Acid, Niacinamide, Peptides, Korean Toner, Korean Moisturizer, Korean Serum, Korean Cleanser, Skin Barrier, Centella Asiatica, K-Beauty, Korean Skincare, HARAMOON"
Panthenol: The Ultimate Hydrating Powerhouse for All Skin Types,https://cdn.shopify.com/s/files/1/0803/5283/7944/articles/panthenol-the-ultimate-hydrating-powerhouse-for-all-skin-types-7172478.png?v=1767479351,HARAMOON K-Beauty Skincare,,"What is Panthenol?Panthenol, also known as provitamin B5, is a humectant and emollient that has become a staple ingredient in Korean skincare formulations. When applied topically, panthenol converts to pantothenic acid (vitamin B5) in the skin, delivering deep hydration and supporting the skin's natural barrier function.Key Benefits of PanthenolDeep Hydration: Panthenol is a... | Shop at waxandwane.store",https://www.waxandwane.store/blogs/haramoon/panthenol-the-ultimate-hydrating-powerhouse-for-all-skin-types,,"Hyaluronic Acid, Ceramides, Vitamin C, Korean Toner, Korean Moisturizer, Korean Serum, Skin Barrier, K-Beauty, Korean Skincare, HARAMOON, Wax and Wane"
"Niacinamide, also known as nicotinamide, is the active form of vitamin B3.",https://cdn.shopify.com/s/files/1/0803/5283/7944/articles/niacinamide-also-known-as-nicotinamide-is-the-active-form-of-vitamin-b3-9529925.png?v=1767479316,HARAMOON K-Beauty Skincare,,"Niacinamide, also known as nicotinamide, is the active form of vitamin B3. Here’s how they relate: | Shop at waxandwane.store",https://www.waxandwane.store/blogs/haramoon/niacinamide-also-known-as-nicotinamide-is-the-active-form-of-vitamin-b3-here-s-how-they-relate,,"Niacinamide, HARAMOON, Korean Skincare, K-Beauty, Wax and Wane"
The Science of Stillness: Inside HARAMOON’s Derma Limpidé Dam Cream,https://cdn.shopify.com/s/files/1/0803/5283/7944/articles/the-science-of-stillness-inside-haramoons-derma-limpide-dam-cream-7605633.png?v=1767479314,HARAMOON K-Beauty Skincare,,"In Seoul’s skincare philosophy, skin isn’t meant to be “fixed” — it’s meant to be respected.The Derma Limpidé Dam Cream was created for that exact purpose: to support the skin’s natural rhythm instead of rewriting it. | Shop at waxandwane.store",https://www.waxandwane.store/blogs/haramoon/the-science-of-stillness-inside-haramoon-s-derma-limpide-dam-cream,,"Hyaluronic Acid, Ceramides, Skin Barrier, Centella Asiatica, Korean Skincare, HARAMOON, K-Beauty, Wax and Wane"
The Quiet Science of Clean: Inside HARAMOON’s Pure Moisture Cleanser,https://cdn.shopify.com/s/files/1/0803/5283/7944/articles/the-quiet-science-of-clean-inside-haramoons-pure-moisture-cleanser-2835398.png?v=1767479313,HARAMOON K-Beauty Skincare,,"In Korean skincare, cleansing is never an afterthought. It’s the foundation of calm skin — a ritual meant to prepare, not punish. The HARAMOON Pure Moisture Cleanser was designed with that philosophy in mind: to purify without imbalance, to refresh without friction. | Shop at waxandwane.store",https://www.waxandwane.store/blogs/haramoon/the-quiet-science-of-clean-inside-haramoon-s-pure-moisture-cleanser,,"Hyaluronic Acid, Korean Moisturizer, Korean Cleanser, Korean Sunscreen, Skin Barrier, pH 5.5, Korean Skincare, HARAMOON, K-Beauty, Wax and Wane"
Why pH 5.5 Matters: The Hidden Science Behind HARAMOON’s Pure Moisture Cleanser,https://cdn.shopify.com/s/files/1/0803/5283/7944/articles/why-ph-55-matters-the-hidden-science-behind-haramoons-pure-moisture-cleanser-2624707.png?v=1768602411,HARAMOON K-Beauty Skincare,,"The pH Balance Your Skin Is Begging ForIf you've ever wondered why some cleansers leave your skin feeling tight, stripped, and irritated while others feel soothing and hydrating, the answer often comes down to one critical factor: pH.Your skin's natural pH sits around 5.5—slightly acidic—and maintaining this delicate balance is essential for a healthy, resilient complexion. ... | Shop at waxandwane.store",https://www.waxandwane.store/blogs/haramoon/why-ph-5-5-matters-the-hidden-science-behind-haramoon-s-pure-moisture-cleanser,,"Hyaluronic Acid, Korean Toner, Korean Moisturizer, Korean Serum, Korean Cleanser, Korean Sunscreen, Skin Barrier, Collagen, Centella Asiatica, pH 5.5, K-Beauty, Korean Skincare"
The Science of Korean Toner Layering: Inside HARAMOON’s Derma Super Dam Toner,https://cdn.shopify.com/s/files/1/0803/5283/7944/articles/the-science-of-korean-toner-layering-inside-haramoons-derma-super-dam-toner-6895234.png?v=1767479311,HARAMOON K-Beauty Skincare,,"HARAMOON’s Derma Super Dam Toner isn’t about exfoliation or astringency — it’s about restoring rhythm to moisture flow. In Seoul, hydration isn’t achieved in one sweep but through gentle repetition. Each layer lets skin absorb what it needs, not more, not less. | Shop at waxandwane.store",https://www.waxandwane.store/blogs/haramoon/the-science-of-korean-toner-layering-inside-haramoon-s-derma-super-dam-toner,,"Hyaluronic Acid, Niacinamide, Korean Toner, Centella Asiatica, Korean Skincare, HARAMOON, K-Beauty, Wax and Wane"
Ampoule Ingredient Story,https://cdn.shopify.com/s/files/1/0803/5283/7944/articles/ampoule-ingredient-story-3716770.png?v=1767479310,HARAMOON K-Beauty Skincare,,"Every drop of the HARAMOON Ampoule was designed in Seoul with one quiet intention: to bring comfort back to skin that’s been through too much — irritation, stress, dehydration, or the fatigue of over-correction. Each ingredient was chosen not just for what it does, but for how it makes skin feel — steady, cared for, and luminous again. | Shop at waxandwane.store",https://www.waxandwane.store/blogs/haramoon/ampoule-ingredient-story,,"Hyaluronic Acid, Niacinamide, Korean Skincare, HARAMOON, K-Beauty, Wax and Wane"
Beauty Marketing & Product Recycling: Unmasking the Psychological Playbook,https://cdn.shopify.com/s/files/1/0803/5283/7944/articles/beauty-marketing-product-recycling-unmasking-the-psychological-playbook-5019626.png?v=1767479301,HARAMOON K-Beauty Skincare,,"Beauty advertising is designed to do more than show products; it taps into deep psychological needs like belonging, confidence and youth. An infamous marketing study urged brands to “concentrate media during prime vulnerability moments” when women feel least attractive—Monday mornings and times of stress[18]. The study suggested that when women are sick or crying they are mo... | Shop at waxandwane.store",https://www.waxandwane.store/blogs/haramoon/beauty-marketing-product-recycling-unmasking-the-psychological-playbook,,"Skin Barrier, Glass Skin, HARAMOON, Korean Skincare, K-Beauty, Wax and Wane"
Behind the Counter: The Conglomerates Controlling Your Makeup Bag,https://cdn.shopify.com/s/files/1/0803/5283/7944/articles/behind-the-counter-the-conglomerates-controlling-your-makeup-bag-9713090.png?v=1775522359,HARAMOON K-Beauty Skincare,,"Walk into your local Sephora or Ulta and imagine dividing the walls by ownership. L'Oréal, Estée Lauder, Coty, and LVMH together control most of the shelves. | Shop at waxandwane.store",https://www.waxandwane.store/blogs/haramoon/behind-the-counter-the-conglomerates-controlling-your-makeup-bag,,"HARAMOON, Korean Skincare, K-Beauty, Wax and Wane"
Centella Asiatica: The Ancient Herb Revolutionizing Modern Skincare,https://cdn.shopify.com/s/files/1/0803/5283/7944/articles/centella-asiatica-the-ancient-herb-revolutionizing-modern-skincare-8733741.png?v=1767479293,HARAMOON K-Beauty Skincare,,"In the ever-evolving world of beauty and skincare, there's one ancient herb that's come to the forefront: Centella Asiatica. | Shop at waxandwane.store",https://www.waxandwane.store/blogs/haramoon/centella-asiatica-the-ancient-herb-revolutionizing-modern-skincare,,"Retinol, Korean Toner, Korean Moisturizer, Korean Serum, Skin Barrier, Collagen, Centella Asiatica, Vegan Skincare, Glass Skin, K-Beauty, Korean Skincare, HARAMOON"
HARAMOON Anti-Photoaging Immortal Peptide Serum,https://cdn.shopify.com/s/files/1/0803/5283/7944/articles/haramoon-anti-photoaging-immortal-peptide-serum-9820536.jpg?v=1767810728,HARAMOON K-Beauty Skincare,,Introduction to HARAMOON Anti-Photoaging Immortal Peptide Serum | Shop at waxandwane.store,https://www.waxandwane.store/blogs/haramoon/haramoon-anti-photoaging-immortal-peptide-serum,,"Hyaluronic Acid, Peptides, Korean Serum, Korean Cleanser, Skin Barrier, pH 5.5, HARAMOON, Korean Skincare, K-Beauty, Wax and Wane"
HARAMOON Skincare Philosophy,https://cdn.shopify.com/s/files/1/0803/5283/7944/articles/haramoon-skincare-philosophy-7534144.jpg?v=1767479292,HARAMOON K-Beauty Skincare,,"HARAMOON honors the timeless aspiration for smooth, resilient skin—an ideal rooted in attentive, sustained care. | Shop at waxandwane.store",https://www.waxandwane.store/blogs/haramoon/haramoon-skincare-philosophy,,"Korean Serum, Skin Barrier, HARAMOON, Korean Skincare, K-Beauty, Wax and Wane"
Niacinamide: The Brightening Barrier Booster,https://cdn.shopify.com/s/files/1/0803/5283/7944/articles/niacinamide-the-brightening-barrier-booster-1985635.png?v=1775522355,HARAMOON K-Beauty Skincare,,"In the world of skincare, few ingredients are as respected and versatile as Niacinamide, also known as Vitamin B3. Loved by dermatologists and formulators alike, this water-soluble vitamin has earned its reputation for helping skin look balanced, bright, and comfortably hydrated — all without harshness. | Shop at waxandwane.store",https://www.waxandwane.store/blogs/haramoon/niacinamide-the-brightening-barrier-booster,,"Hyaluronic Acid, Niacinamide, Skin Barrier, HARAMOON, Korean Skincare, K-Beauty, Wax and Wane"
"Korean Toner, Upgraded: Why Water-Oil Balance Is Your Skin's Superpower",https://cdn.shopify.com/s/files/1/0803/5283/7944/articles/korean-toner-upgraded-why-water-oil-balance-is-your-skins-superpower-8655541.png?v=1767479281,HARAMOON K-Beauty Skincare,,"Korean Toner, Upgraded: Why Water-Oil Balance Is Your Skin's Superpower | Shop at waxandwane.store",https://www.waxandwane.store/blogs/haramoon/korean-toner-upgraded-why-water-oil-balance-is-your-skin-aos-superpower,,"Hyaluronic Acid, Korean Toner, Jeju Water, Korean Skincare, HARAMOON, K-Beauty, Wax and Wane"
Hydration Starts Here: The Science of a Skin-Calming Cleanse,https://cdn.shopify.com/s/files/1/0803/5283/7944/articles/hydration-starts-here-the-science-of-a-skin-calming-cleanse-8620862.jpg?v=1768602406,HARAMOON K-Beauty Skincare,,"The Foundation of Every Skincare RoutineYour cleanser is the first conversation your skin has with your routine—and for sensitive, barrier-compromised skin, that conversation needs to be gentle, hydrating, and restorative. The HARAMOON Pure Moisture Cleanser was formulated with this philosophy at its core: cleansing shouldn't strip, stress, or sensitize. Instead, it should p... | Shop at waxandwane.store",https://www.waxandwane.store/blogs/haramoon/hydration-starts-here-the-science-of-a-skin-calming-cleanse,,"Hyaluronic Acid, Korean Toner, Korean Moisturizer, Korean Serum, Korean Cleanser, Skin Barrier, Centella Asiatica, Korean Skincare, HARAMOON, K-Beauty, Wax and Wane"
US Demand Fuels K-Beauty Boom,https://cdn.shopify.com/s/files/1/0803/5283/7944/articles/us-demand-fuels-k-beauty-boom-1876893.png?v=1768602404,HARAMOON K-Beauty Skincare,,"Why American Shelves Can't Stay Stocked With K-Beauty Despite Trade TensionsU.S. demand for Korean skincare is soaring—fueled by clinical performance, transparent ingredients, and sensory elegance. Even as trade policy debates and tariff discussions dominate headlines in early 2026, American consumers continue to reach for K-beauty products at unprecedented rates. Brands lik... | Shop at waxandwane.store",https://www.waxandwane.store/blogs/haramoon/us-demand-fuels-k-beauty-boom,,"Hyaluronic Acid, Ceramides, Niacinamide, Peptides, Korean Toner, Korean Serum, Korean Cleanser, Skin Barrier, Centella Asiatica, K-Beauty, Korean Skincare, HARAMOON"
