Title,Media URL,Pinterest board,Thumbnail,Description,Link,Publish date,Keywords
Korean Beauty Startups Bet on Booming US Demand,https://cdn.shopify.com/s/files/1/0803/5283/7944/articles/cleanserbanner3_f7994d3b-29af-4985-944b-44169add9632.png?v=1775256804,HARAMOON K-Beauty Skincare,,Introduction to Korean Beauty Startups Bet on Booming US Demand | Shop at waxandwane.store,https://www.waxandwane.store/blogs/haramoon/korean-beauty-startups-bet-on-booming-us-demand-1,,"Hyaluronic Acid, Peptides, Korean Serum, Korean Cleanser, Skin Barrier, pH 5.5, Korean Skincare, HARAMOON, K-Beauty, Wax and Wane"
Why Western Beauty Giants Are Pulling Out of South Korea — and What It Means for Skincare's Future,https://cdn.shopify.com/s/files/1/0803/5283/7944/articles/why-western-beauty-giants-are-pulling-out-of-south-korea-and-what-it-means-for-skincares-future-4518378.jpg?v=1775522351,HARAMOON K-Beauty Skincare,,"In a quiet but telling shift, Western beauty giants are bowing out of South Korea — a market long considered the global litmus test for skincare innovation. | Shop at waxandwane.store",https://www.waxandwane.store/blogs/haramoon/why-global-beauty-brands-are-retreating-from-korea,,"Hyaluronic Acid, Ceramides, Peptides, Korean Skincare, HARAMOON, K-Beauty, Wax and Wane"
The Ultimate Korean Toner Routine for Perfect Skin - HARAMOON Clean + Clear Toner - For Stressed and,https://cdn.shopify.com/s/files/1/0803/5283/7944/articles/the-ultimate-korean-toner-routine-for-perfect-skin-haramoon-clean-clear-toner-for-stressed-and-sensitive-skin-types-6985065.png?v=1767479271,HARAMOON K-Beauty Skincare,,"When it comes to achieving flawless skin, Korean skincare routines are renowned for their effectiveness. | Shop at waxandwane.store",https://www.waxandwane.store/blogs/haramoon/4-ways-to-use-toner,,"Korean Toner, Korean Cleanser, Korean Skincare, HARAMOON, K-Beauty, Wax and Wane"
Hydration From Within : HARAMOON Centella Moisturizing Cream,https://cdn.shopify.com/s/files/1/0803/5283/7944/articles/hydration-from-within-haramoon-centella-moisturizing-cream-8267491.png?v=1768602400,HARAMOON K-Beauty Skincare,,"Why does your skin stay dry, no matter how much moisturizer you apply? | Shop at waxandwane.store",https://www.waxandwane.store/blogs/haramoon/hydration-from-within-haramoon-centella-moisturizing-cream,,"Hyaluronic Acid, Ceramides, Niacinamide, Retinol, SPF Sunscreen, Korean Toner, Korean Moisturizer, Korean Cleanser, Korean Sunscreen, Skin Barrier, Collagen, Centella Asiatica"
Ingredient Spotlight : Beta-Glucan,https://cdn.shopify.com/s/files/1/0803/5283/7944/articles/ingredient-spotlight-beta-glucan-5813659.png?v=1768602398,HARAMOON K-Beauty Skincare,,"The Unsung Hero of Barrier-Repair SkincareIn the world of skincare ingredients, some actives get all the spotlight—hyaluronic acid, niacinamide, retinol. But there's one powerhouse ingredient that deserves far more recognition: Beta-Glucan.This naturally derived polysaccharide is a skin-soothing, barrier-strengthening, hydration-boosting marvel that works quietly behind the ... | Shop at waxandwane.store",https://www.waxandwane.store/blogs/haramoon/ingredient-spotlight-beta-glucan,,"Hyaluronic Acid, Ceramides, Niacinamide, Peptides, Retinol, SPF Sunscreen, Korean Toner, Korean Moisturizer, Korean Serum, Korean Cleanser, Korean Sunscreen, Skin Barrier"
Hyaluronic Acid and Aging - Why is it important?,https://cdn.shopify.com/s/files/1/0803/5283/7944/articles/hyaluronic-acid-and-aging-why-is-it-important-2792314.jpg?v=1775522349,HARAMOON K-Beauty Skincare,,"Imagine the feeling of water against your skin — cool, weightless, and restorative. That’s the essence of Hyaluronic Acid (HA), one of skincare’s most celebrated ingredients and the quiet powerhouse behind every luminous, hydrated complexion. | Shop at waxandwane.store",https://www.waxandwane.store/blogs/haramoon/hyaluronic-acid-and-aging-why-is-it-important,,"Hyaluronic Acid, Skin Barrier, Korean Skincare, HARAMOON, K-Beauty, Wax and Wane"
HARAMOON Immortal Peptide Serum | Night Care Routine,https://cdn.shopify.com/s/files/1/0803/5283/7944/articles/HARAMOON_IMMORTAL_SERUM_c9001036-41db-44a5-b1db-8b564d7e85bd.gif?v=1752513107,HARAMOON K-Beauty Skincare,,"After cleansing, apply an acidic toner to balance pH and refine texture. | Shop at waxandwane.store",https://www.waxandwane.store/blogs/haramoon/haramoon-immortal-peptide-serum-vegan-ewg-certified-for-all-skin-types-50ml,,"Peptides, Korean Toner, Korean Serum, HARAMOON, Korean Skincare, K-Beauty, Wax and Wane"
Peptides vs Ceramides vs Niacinamide — What Your Skin Barrier Actually Needs,https://files.manuscdn.com/user_upload_by_module/session_file/310419663029718527/VBKRempSIzxClHdn.jpg,HARAMOON K-Beauty Skincare,,Your skin barrier runs on three ingredients. Here's what each one actually does — and why HARAMOON formulas are built around all three. Swipe to learn the science behind the skin barrier.,https://www.waxandwane.store/blogs/haramoon,,"Korean Skincare, Skincare Science, Peptides, Ceramides, Niacinamide, Skin Barrier, HARAMOON Skincare, Clean Beauty, EWG Verified, Vegan Skincare, K-Beauty, Ingredient Nerd"
Deep Sea Water Toner — 7 Types of Hyaluronic Acid in One Formula,https://files.manuscdn.com/user_upload_by_module/session_file/310419663029718527/mWKuwwOWNCcWOHnY.jpg,HARAMOON K-Beauty Skincare,,7 types of hyaluronic acid. Deep sea minerals. pH 5.5. EWG Verified. Vegan. The HARAMOON Derma Super Dam Toner doesn't just hydrate — it rebuilds your moisture barrier from the inside out. One layer at a time.,https://www.waxandwane.store/blogs/haramoon,,"Deep Sea Water, Hyaluronic Acid, Korean Toner, Skin Barrier, HARAMOON, K-Beauty Toner, pH 5.5, EWG Verified, Vegan Skincare, Korean Skincare"
Your Skin's Strongest Barrier — HARAMOON Dam Cream,https://files.manuscdn.com/user_upload_by_module/session_file/310419663029718527/fMuEElMChJZZDQlv.jpg,HARAMOON K-Beauty Skincare,,"Modern stressors — pollution, blue light, stress — are quietly wrecking your skin barrier every day. The HARAMOON Derma Limpide Dam Cream was formulated for exactly that. Science-backed hydration that protects, repairs, and holds.",https://www.waxandwane.store/blogs/haramoon,,"Skin Barrier, Barrier Repair, HARAMOON, Korean Moisturizer, Centella Cream, K-Beauty, Sensitive Skin, Clean Beauty, Vegan Skincare, Korean Skincare"
"The Full HARAMOON Skincare Routine — 4 Steps, All EWG Verified",https://files.manuscdn.com/user_upload_by_module/session_file/310419663029718527/qpqyYSnbgcXeSFPZ.jpg,HARAMOON K-Beauty Skincare,,"Cleanse without stripping. Hydrate without heaviness. Protect without clogging. The complete HARAMOON skin barrier routine — 4 steps, all EWG Verified, all pH 5.5 balanced.",https://www.waxandwane.store/blogs/haramoon,,"Korean Skincare Routine, Skin Barrier Solution, HARAMOON, 4-Step Skincare, K-Beauty Routine, pH Balanced, EWG Verified, Vegan Skincare, Korean Skincare, Clean Beauty"
The pH 5.5 Reset — HARAMOON Super Dam Toner with Jeju Mineral Water,https://files.manuscdn.com/user_upload_by_module/session_file/310419663029718527/XvvtWNEipNjqUPvr.jpg,HARAMOON K-Beauty Skincare,,Jeju mineral water meets 7-layer hyaluronic acid. The HARAMOON Super Dam Toner resets your skin's pH to 5.5 — the sweet spot for barrier health — while flooding every layer with moisture.,https://www.waxandwane.store/blogs/haramoon,,"pH 5.5 Toner, Jeju Water, Hyaluronic Acid, HARAMOON, Korean Toner, Skin Reset, K-Beauty, Barrier Care, Vegan Skincare, Korean Skincare"
